{"bindings":{"analysis_schema_sha256":"17c842e70f8ebe8b308115562f94e2ee64b0e86caf4a83236d1262e32509c3f9","artifact_sha256":"0f87af4dfd851c268891c96237accf20b5089b0e0b95e10ac1417efebcca83a9","branch":"release/v.1.0.0","corpus_sha256":"4f768f151885d26de48fe0744cafc2402a27aca61f7f049aac166309891e0c92","d2a_report_sha256":"747b4f1590eda9787c87aae2e25853b8e1e8fa04893e2359eedf7a6050b7acb3","d2e_protocol_sha256":"d412ba3a4311640234b9291ac458da321a77db9da0df310cfd3186a56cad3f41","evaluation_protocol_sha256":"8d6b59e879cd35093f265207d5fec9e6e567f0bd66765cd73c75e1e63b65c0a6","package_version":"0.4.0-rc.1","paired_ablation_sha256":"132aeaf85984d791aa6c2335e498cb80ebfe4f99c7924230e7b487585237573a","parent_commit":"949158dca8d737a9892fe8a696e60e196d3649c8","post_correction_authority_sha256":"b4227670b7b831f1949598add2fa538c875cdb90ab55b1820a35ba81b5543087","post_correction_evaluation_sha256":"002b31db1a3c44e488466ff6655707f07c38a0f21487cd9dc0b5d5b4424c8b30","post_correction_evidence_tree_sha256":"b2259cef72b0bba7b37fbab37f1d0edcbd592235f92b5813da7f814855f74636","public_capabilities_sha256":"bfc00d445cc480389559fd8c115a6ae2607dd6b7241dd0e256565bde5f0256cf","scoring_policy_sha256":"1b625f6a16ff5eaa985d8d2d504fd615206b0b0147807d68f467e151a5604a6c","strict_historical_equivalence":"failed-required-comparison-unavailable","threshold_projection_sha256":"680fcdc9c899dfe1122941f4e59fb9ed917756eeeb17b40273425861a900e749","trace_schema_sha256":"5a938a24c774cbf9deef7c764184270ae1925a8edbfeecf321c9d2b4844d8c72","withdrawal_commit":"949158dca8d737a9892fe8a696e60e196d3649c8","withdrawal_record_sha256":"4b2fd7699808cb8682095f29a1ac68a1dac5e3d81c1301bc2a18e58e8f1e8967"},"candidate_development":{"allowed_evidence":["historical-visible-development","prospective-development"],"candidate_freeze":{"bindings":["source_commit","artifact_sha256","package_version","dependency_lock_sha256","runtime_dependency_count","public_capabilities_sha256","corpus_configuration_sha256","scoring_policy_sha256","threshold_projection_sha256","generated_tree_sha256","complete_test_tree_sha256","validation_record_sha256","evaluation_runner_sha256","evaluation_finalizer_sha256","evaluation_serializer_sha256","trace_schema_sha256","report_schema_sha256","release_evidence_schema_sha256"],"development_gates":["prospective-development-target-complete","existing-performance-thresholds-pass-without-amendment","direct-and-final-cap-displacement-effects-accounted","all-production-safety-compatibility-and-artifact-gates-pass","no-unresolved-p0-or-p1","holdout-identity-and-content-remain-blinded"],"post_freeze_mutation_allowed":false},"correction_requirements":{"bounded_implementation_authority_required":true,"generic_hypothesis_predeclared_before_implementation":true,"must_measure_direct_and_final_cap_displacement":true,"repository_path_label_category_or_case_specific_rules_allowed":false},"failed_holdout_reuse_allowed":false,"holdout_evidence_allowed":false},"conclusions":{"allowed":["release-supported","release-not-supported","inconclusive"],"automatic_release_allowed":false,"derivation":{"inconclusive":"one-or-more-required-gates-unknown-or-essential-evidence-cannot-be-validly-completed","release-not-supported":"all-required-gates-known-and-one-or-more-fail","release-supported":"every-required-gate-passes"},"final_human_release_decision_required":true,"human_override_of_failed_or_unknown_gate_allowed":false,"required_gates":["agreement","artifact_identity","binding","blindness","candidate_freeze","category_coverage","compatibility","complete_case_results","confidence_precision","containment","contamination","coverage","deterministic_artifact","governance","incomplete_scans","installed_conformance","integrity","inventory","label_validity","no_post_freeze_mutation","no_post_result_rule_change","observer_failures","one_use_attempt","performance_thresholds","safety","sample_size","schema","trace_equivalence","weighted_error"]},"corpus_selection":{"activity":{"created_at_or_before":"2024-07-30T00:00:00Z","eligible_revision_at_or_after":"2025-01-30T00:00:00Z","revision_cutoff":"2026-07-30T00:00:00Z","revision_rule":"latest-full-commit-sha-at-or-before-cutoff"},"category_eligibility":{"go-service":{"primary_language":"Go","required_any_topic":["api","backend","microservice","server","web-service"]},"monorepo":{"content_validation":"at-least-three-declared-packages-or-workspaces-under-two-or-more-top-level-components","required_any_topic":["monorepo"]},"python-ml":{"primary_language":"Python","required_any_topic":["data-science","deep-learning","machine-learning","ml"]},"python-web":{"primary_language":"Python","required_any_topic":["django","fastapi","flask","web","web-framework"]},"rust-cli":{"primary_language":"Rust","required_any_topic":["cli","command-line","command-line-tool"]}},"category_quotas":{"go-service":40,"monorepo":40,"python-ml":40,"python-web":40,"rust-cli":40},"content_access":{"allowed_only_after_provisional_selection":true,"allowed_roles":["holdout-custodian","independent-labeler","disagreement-adjudicator","evaluation-executor"],"candidate_owner_access_before_candidate_freeze":false,"content_fields_forbidden_during_metadata_only_stage":["archive-or-clone","commit-message","diff","file-content","file-name-or-tree","issue-or-pull-request-content","readme","release-asset","workflow-content"]},"duplicate_and_contamination":{"contamination_inherits_transitively":true,"material_duplicate_rule":"reject-when-at-least-20-non-generated-non-vendored-files-and-at-least-80-percent-of-the-smaller-projects-normalized-file-bytes-are-identical","relations_that_disqualify_holdout_overlap":["canonical-identity","fork-network","mirror","shared-reachable-commit","template-origin","equal-revision-tree","material-duplicate"],"shared_history_rule":"any-shared-reachable-commit-disqualifies","template_rule":"platform-template-lineage-or-material-duplicate-rule-disqualifies"},"eligible_source_population":{"archived":false,"disabled":false,"fork":false,"host":"github.com","license_allowlist":["Apache-2.0","BSD-2-Clause","BSD-3-Clause","GPL-2.0-only","GPL-2.0-or-later","GPL-3.0-only","GPL-3.0-or-later","ISC","LGPL-2.1-only","LGPL-2.1-or-later","LGPL-3.0-only","LGPL-3.0-or-later","MIT","MPL-2.0"],"local_clone_and_evaluation_permitted":true,"private":false,"provider_size_kib_maximum":1048576,"provider_size_kib_minimum":1024,"source":"complete-custodian-attested-public-repository-metadata-snapshot","source_snapshot_committed_before_filtering":true},"identity":{"canonical_repository_identity":"lowercase-host-plus-provider-repository-node-id-plus-canonical-owner-and-name","registry_uses_concealed_sha256_identifiers_for_holdout":true,"revision_identity":"full-40-character-commit-sha","same-project-relations_are-transitive":true},"language_and_ecosystem_balance":{"maximum_overall_primary_language_fraction":0.45,"monorepo_minimum_distinct_primary_ecosystems":4,"monorepo_minimum_per_ecosystem":5,"monorepo_primary_ecosystem_maximum":10},"metadata_only_fields":["archived","canonical-owner-and-name","created-at","disabled","fork-parent-node-id","fork-root-node-id","license-identifier","primary-language","private","provider-repository-node-id","provider-size-kib","pushed-at","template-source-node-id","topics","updated-at"],"random_selection":{"combined_seed":"sha256-utf8-domain-kanon-v1.0.0-holdout-selection-v1-nul-custodian-seed-nul-release-owner-seed-nul-population-sha256-nul-protocol-sha256","entropy_bytes_per_human":32,"entropy_commitment":"sha256-over-domain-separated-role-and-raw-entropy","entropy_committers":["holdout-custodian","release-decision-owner"],"population_committed_before_entropy_reveal":true,"ranking":"ascending-hmac-sha256-combined-seed-over-category-size-bin-and-concealed-canonical-identity","seed_commitments_before_population_snapshot_access":true},"replacement":{"after_attempt_consumption_allowed":false,"after_outcome_or_prediction_access_allowed":false,"maximum_per_category":4,"maximum_total":20,"removed_identity_becomes_contaminated":true,"rule":"next-precommitted-ranked-reserve-in-the-same-category-size-and-language-stratum","when_allowed":["repository-unavailable-before-final-manifest","license-or-local-use-failure-before-final-manifest","identity-duplicate-or-contamination-before-final-manifest","content-eligibility-failure-before-label-freeze","labelability-failure-before-label-freeze"]},"selection_abort_conditions":["eligible-population-snapshot-coverage-not-attested","category-or-balance-quota-cannot-be-filled","replacement-total-exceeds-20","replacement-category-exceeds-4","contamination-registry-completeness-cannot-be-attested","holdout-identity-or-content-exposed-to-candidate-owner-before-freeze"],"size_balance_per_category":{"large_102400_to_1048576_kib_minimum":8,"maximum_any_size_bin":24,"medium_10240_to_102399_kib_minimum":8,"small_1024_to_10239_kib_minimum":8}},"evidence_partitions":{"historical-visible-development":{"includes":["existing-30-case-corpus","every-previously-inspected-repository","every-fork-mirror-shared-history-template-or-material-duplicate-derivative","all-existing-labels-candidates-traces-outcomes-and-derived-records"],"permitted":["diagnostics","hypothesis-generation","test-design"],"prohibited":["holdout","independent-validation","official-release-score"]},"one-use-unseen-holdout":{"identity_or_content_disclosure_before_candidate_freeze":"permanent-case-disqualification","permitted":["single-execution-against-one-frozen-candidate"],"prohibited":["debugging","mechanism-discovery","threshold-selection","prompt-design","correction-iteration","silent-replacement"]},"prospective-development":{"contamination_on_identity_or_content_exposure":"permanent","permitted":["bounded-correction-cycles","diagnostics","hypothesis-generation","test-design"],"prohibited":["holdout","independent-validation","official-release-score"]}},"forbidden":["access-or-select-prospective-repository-in-this-freeze","automatic-release-from-mechanical-or-model-recommendation"